<!-- 
 * UniTime 3.2 (University Timetabling Application)
 * Copyright (C) 2011, UniTime LLC
 * 
 * This program is free software; you can redistribute it and/or modify
 * it under the terms of the GNU General Public License as published by
 * the Free Software Foundation; either version 3 of the License, or
 * (at your option) any later version.
 * 
 * This program is distributed in the hope that it will be useful,
 * but WITHOUT ANY WARRANTY; without even the implied warranty of
 * MERCHANTABILITY or FITNESS FOR A PARTICULAR PURPOSE.  See the
 * GNU General Public License for more details.
 * 
 * You should have received a copy of the GNU General Public License along
 * with this program.  If not, see <http://www.gnu.org/licenses/>.
 * 
 -->
 
<!ELEMENT unitime-menu (menu|item|separator)* >
 
<!ELEMENT menu (condition?, (menu|item|separator)*) >
<!ATTLIST menu name CDATA #REQUIRED >
<!ATTLIST menu title CDATA #IMPLIED >
<!ATTLIST menu page CDATA #IMPLIED >
<!ATTLIST menu type (gwt|property) #IMPLIED >
<!ATTLIST menu target (download|dialog) #IMPLIED >
 
<!ELEMENT separator (condition?) >

<!ELEMENT item (condition?) > 
<!ATTLIST item name CDATA #REQUIRED >
<!ATTLIST item page CDATA #REQUIRED >
<!ATTLIST item type (gwt|property) #IMPLIED >
<!ATTLIST item target (download|dialog) #IMPLIED >

<!ELEMENT condition (and|or|not|isAuthenticated|hasRole|hasProperty|propertyEquals|hasRight)* >

<!ELEMENT and (and|or|not|isAuthenticated|hasRole|hasProperty|propertyEquals|hasRight)* >
<!ELEMENT or (and|or|not|isAuthenticated|hasRole|hasProperty|propertyEquals|hasRight)* >
<!ELEMENT not (and|or|not|isAuthenticated|hasRole|hasProperty|propertyEquals|hasRight)* >
 
 <!ELEMENT isAuthenticated EMPTY >
 
<!ELEMENT hasRole EMPTY >
<!ATTLIST hasRole name CDATA #IMPLIED >

<!ELEMENT hasProperty EMPTY >
<!ATTLIST hasProperty name CDATA #REQUIRED >

<!ELEMENT propertyEquals EMPTY >
<!ATTLIST propertyEquals name CDATA #REQUIRED >
<!ATTLIST propertyEquals value CDATA #REQUIRED >
<!ATTLIST propertyEquals defaultValue CDATA #IMPLIED >

<!ELEMENT hasRight EMPTY >
<!ATTLIST hasRight name (canSeeCourses|canSeeTimetable|hasASolverGroup|canDoTimetable|canAudit|canSectionStudents|isSectioningEnabled|isRegistrationEnabled|canSeeEvents|isChameleon|hasPersonalReport|isStudent|hasRoomAvailability|canSeeExams|canTimetableExams) #REQUIRED >

 
 
 
 
 